{
  "schema_version": "1.0",
  "task_id": "DATA-001",
  "reviewer": "codex-security",
  "reviewed_commit": "62aaa584ea415c290a22f0dd0d6b601f2c261000",
  "status": "APPROVED",
  "summary": "Approved exact commit 62aaa584ea415c290a22f0dd0d6b601f2c261000 with no unresolved blocking security finding. The residual source-path issue is remediated: type/length/character/normalization/traversal/global-root/uniqueness checks run before classification, role, identity, and content findings; approved-synthetic-local inputs require the exact four manifest role/path pairs; project-authored inputs are confined below tests/fixtures/fhir/data-001/; every source-layer failure uses a fixed schema-safe path; all-four other/ paths reject; and traversal/newline combined with prohibited classification produces a sanitized schema-valid rejected outcome while distinct rejected bytes retain distinct observed digests. All prior remediations remain effective: exact bounded nested shape/type checks and eight complexity limits fail closed; strict JSON rejects duplicate keys, non-finite constants, and parser recursion; required references remain relative, same-source-set, uniquely resolved, and never fetched; narrative, attachment, modifier, contained, and executable Bundle surfaces reject; and rejection messages do not echo untrusted content. The required networkless DATA001_REQUIRE_OFFLINE suite passes 98 tests and the agentic regression passes 12 tests with seed bytes unchanged. CARIN remains non-authoritative and nonconformant with 450 errors and 445 warnings preserved as 895 canonical issue digests only after checksum-verifying the 1,556,152-byte raw OperationOutcome, validator, runtime, and all 30 packages (32 artifacts total); missing or changed evidence becomes diagnostic-unavailable. Opaque terminology remains unverified and cannot independently support consequential conclusions. Verification commit 246a52cc397a3971c2504493b5f175d05e73895d is current because later changes are only verification evidence and task status. The corrected ADR/provenance, synthetic-only, no-real-PHI, no-production/upload/network lookup, no-invented-semantics, evidence-grounding, CARIN diagnostic separation, secret-free, and human consequential-authority invariants remain intact.",
  "findings": []
}
