{
  "schema_version": "1.0",
  "task_id": "DEMO-001",
  "reviewer": "codex-reviewer",
  "reviewed_commit": "40277dbc4b3517aa1c70bd30779cef2ac172115a",
  "status": "APPROVED",
  "summary": "Approved exact current commit 40277dbc4b3517aa1c70bd30779cef2ac172115a with no unresolved final-review finding. The only application/tooling source delta since the prior approval is b0eb18382b290987f9f95d791fa26f6b087e79e9: requirements-agent.txt now includes the existing exact-pinned backend/requirements.txt manifest. This preserves backend/requirements.txt as the authoritative direct dependency manifest, satisfies the existing pytest tooling range, changes no architecture, API contract, runtime behavior, test, workflow permission, credential, database, frontend, deployment, real-PHI, or Gemini boundary, and makes the unchanged CI verification command install the packages it exercises. Independent clean-environment evidence installed requirements-agent.txt alone, passed pip check, and passed the complete repository gate; this review independently reran dependency consistency, project/task/OpenAPI validation, all 43 backend tests, all 12 agentic tests, diff hygiene, and approved source hashes. GitHub PR #2 merged b0eb183 in merge commit db51ee0ed33e480b72d91c2db8678ccfc7f5deb5, and its verify, contract-check, and security-baseline checks all completed successfully. Commit-bound verification covers 4257a8ea5fccb565ab3dce316c4fa7b5c7ee9107, and security approved 658bc7b49cc5ef1179d41f8e9f2c8492ed3f9a62; only expected verification/security reports and task status changed afterward, so both remain current for this HEAD. All previously approved acceptance, exact-rule, deterministic-fallback, local /docs, one-call/no-tools structured Gemini, source-immutability, documentation, and security conclusions remain valid. The security report's prompt-role-separation and transitive-lock/audit findings remain accepted non-blocking defense-in-depth work for a future hardening task.",
  "findings": []
}
