{
  "schema_version": "1.0",
  "task_id": "DATA-001",
  "reviewer": "codex-reviewer",
  "reviewed_commit": "b6678098f9c7e34c7cb61191da6cba818873f3f8",
  "status": "CHANGES_REQUIRED",
  "summary": "Changes required on exact commit b6678098f9c7e34c7cb61191da6cba818873f3f8. Project/task/report/OpenAPI validation, the required offline DATA-001 suite (98 passed), agentic regression suite (12 passed), committed-diff checks, verification/security evidence-currency checks, and all four seed SHA-256/Git-blob identities pass. The seed remains byte-identical, terminology remains opaque and unverified, CARIN remains diagnostic-only for the seed, and no prohibited domain semantics were introduced. Release is blocked by input-to-CARIN evidence misattribution, outcome-schema combinations that permit contradictory CARIN evidence, an unhandled strict-JSON numeric parse failure, and an unreconciled Bundle id/total requirement conflict between the approved feature/architecture and executable contract.",
  "findings": [
    {
      "severity": "high",
      "category": "evidence-integrity",
      "file": "tests/data/reference_validator.py",
      "description": "CARIN evidence is not bound to the source set being validated. Every accepted source set receives the checksum-pinned seed OperationOutcome from .offline/evidence/seed-carin-operationoutcomes.json. A project-authored accepted source set with all supported profile markers changed to their |2.2.0 forms still returns the seed digest 2eb1271891b41794b665b639aa2f63138ed597cace33fbd2e3ce45673dcf7d15, the seed counts (450 errors and 445 warnings), and dataset/* finding paths even though its declared source-set digest and paths differ. This misattributes diagnostic evidence and violates the requirement that CARIN findings remain honest structured evidence for the validated input.",
      "recommendation": "Cryptographically bind raw CARIN evidence to the exact observed source-set identity and source paths. For an accepted input without matching pinned evidence, emit carin-diagnostic-unavailable; otherwise run or load diagnostics produced for those exact bytes. Add an accepted non-seed/version-qualified-profile test proving seed diagnostics cannot be reused.",
      "blocking": true
    },
    {
      "severity": "high",
      "category": "contract-consistency",
      "file": "contracts/fhir/data-001/validation-outcome.schema.json",
      "description": "The outcome schema constrains evidence only for carin.status=nonconformant. It accepts carin-no-errors-reported while counts still contain 450 errors and 895 findings, and it accepts carin-diagnostic-unavailable while retaining the same raw evidence, verified artifacts, counts, and findings. Both contradictory objects validate successfully, so downstream consumers cannot rely on the exact state semantics or on unavailable diagnostics failing visibly without stale evidence.",
      "recommendation": "Add conditional schema rules for every CARIN status: no-errors-reported must require verified raw evidence/artifacts and zero fatal/error counts; diagnostic-unavailable must require zero counts/findings and forbid raw_evidence/verified_artifacts; not-run-rejected must remain empty; and each status/state pairing should be covered by positive and negative schema tests.",
      "blocking": true
    },
    {
      "severity": "high",
      "category": "fail-closed-correctness",
      "file": "tests/data/reference_validator.py",
      "description": "strict_json_loads does not translate Python's integer digit-limit ValueError into StrictJsonError. A bounded JSON document containing a 5,000-digit integer causes ReferenceValidator.validate to raise ValueError instead of returning decision=rejected and states=[rejected]. This contradicts the required deterministic fail-closed handling of adversarial JSON and is not covered by the 98-test suite.",
      "recommendation": "Handle numeric-conversion ValueError as a detail-free strict JSON rejection without swallowing the validator's own StrictJsonError, and add a schema-valid regression asserting a huge integer produces JSON-SYNTAX-001 with no exception or raw-value echo.",
      "blocking": true
    },
    {
      "severity": "medium",
      "category": "source-of-truth-reconciliation",
      "file": "docs/features/DATA-001.md",
      "description": "The approved support matrix places Bundle total in the required-rules column and Bundle id in preserve-only metadata, while architecture-report.json describes paging metadata as inert preserve-only. The executable boundary and validator instead require a non-empty Bundle id and accept a missing total. Direct probes confirm missing id is rejected as REQUIRED_ANCHOR_INVALID while missing total is accepted. The exact minimal compatibility requirement is therefore internally inconsistent across authoritative feature, architecture, contract, and tests.",
      "recommendation": "Have the orchestrator/architect explicitly reconcile Bundle id and total optionality, then update the approved feature/architecture and machine contract/harness/tests together. Do not infer either rule during remediation.",
      "blocking": true
    }
  ]
}
